{
  "eventId": "198b82e3-c7b4-45f4-ae53-d7a7f72771e3",
  "eventType": "inventory.updated",
  "timestamp": "2026-02-16T10:24:00.000Z",
  "version": "v1",
  "source": "product-service",
  "payload": {
    "productId": "prd_2001",
    "warehouseId": "wh_us_east_1",
    "delta": -2,
    "previousQty": 20,
    "newQty": 18,
    "reason": "order_allocated",
    "updatedAt": "2026-02-16T10:23:59.000Z"
  }
}
